,UID,Term,Emic_Term,Translit,Scope,Tags,JoinKey,Def,Spec,Source
206,113,bayz,بیض,,indic,seal,113,"""A sort of cipher or monogram formerly affixed to a written paper in place of a signature by Mohammedan functionaries and persons of rank.""",mughals,508.0
207,113,bayz,بیض,,indic,seal,113,A mark fixed to public writings by the magistrate or any principal officer.,,
208,113,bayz,بیض,,indic,seal,113,"Some documents may have only letter ص, usually in bold nib and by a different hand.",mughals,
209,113,bayz,بیض,,indic,seal,113,"The mark is positioned at the end of the document. ""It indicates 'the end', to obviate any later additions by an unauthorized person. It is not clear, however, when the practice was adopted."" (But it is attested as of a 1606 Jahangir farman.)",mughals,519.0
210,113,bayz,بیض,,indic,seal,113,"""Approbation and corrections were indicated thus: یص or by such words as 'bayḍ' and ص.""",,983.0
211,114,bayzana,بیضانه,,indic,sealfinancial,114,"""Fee to magistrates or public officer for affixing his cypher to a deed or document.""",mughals,508.0
212,116,muwafiq-i aslihi,موافق اصله,,,,116,"Note direct Britisher equivalent ""a true copy.""",,
213,117,kos,کوس,,indic,distance,117,"""A measure of distance varying, in different parts of India, from one to two miles, but most usually about the latter... the Kos = 5000 Gaz; and the value depends therefore on that of the Gaz, which at one time varied considerably...""",,508.0
214,119,ta'alluq,تعلق,,indicmughal,land_grant,119,"""an estate... a tract of proprietary land usually smaller than a Zamindari, although sometimes including several villages, and not infrequently confounded with a Zamindari...""",,508.0
215,120,infisal,انفصال,infiṣāl,indic,,120,"""Decision, sentence, award, settlement of an affair.""",,508.0
216,121,jama-bandi,جمعبندی,jamaʿ-bandī,indic,taxes,121,"""Settlement of the amount of revenue assessed upon an estate, a village, or district; a village or district rent-roll...""",228,508.0
217,123,sarkar,سرکار,,indic,,123,"""By the final decade of the eighteenth century, the British East India Company had settled upon an official Persian title for its burgeoning state in India: Sarkar-i Kampani Angrez Bahadur, or “the Government of the Hon’ble [English] Company... Like the code itself, the Company’s adoption of the term “sarkar” had far-reaching effects. Indeed, sarkar remained the primary word by which the colonial state was represented in Indian languages until the mid-twentieth century (when it was replaced by the now more widely known “Raj”), and it continues to be used in both colloquial and official registers of contemporary Hindi/Urdu to denote “the state'... Yet the Company’s choice of the word “sarkar” is, on the surface, a curious one, as the term in eighteenth-century Indo-Persian usage typically connoted not “the state” (at least not in the “modern” sense) but rather one of many competing elite households""",british,
218,123,sarkar,سرکار,,indic,,123,"""Although the word was used in Mughal imperial histories and administrative documents since at least the late-sixteenth century (if not earlier), it did not find its way into Indo-Persian lexicons until the eighteenth century"" (2).",mughals,
219,123,sarkar,سرکار,,indic,,123,"""The term sarkār was widely used in the Mughal period for the administration of a prince or a noble as well as for the sub-division of a province"" citing Irfan Habib.",mughals,519.0
220,124,mu'amala,معامله,,indic,taxes,124,"""Affair, business, negotiation, jurisdiction, suit, management, or conduct of public affairs; civil employment under the government in the south of India, especially in the collection of revenue, and management of a district.""",,508.0
221,125,dafa-dar,دفعدار,,indic,military,125,"""Commandant of a body of horse, head of a party of police, a police officer.""",british,508.0
222,126,muqaddam,,,indic,,126,"""in India applied especially to the head man of a caste or corporattion""",,508.0
223,127,hawal-dar,حواله دار,,indic,,127,"""a native officer of the Indian army, subordinate to the Subahdar""",,508.0
224,127,hawal-dar,حواله دار,,indic,,127,"""a subordinate revenue officer, a kind of deputy of the Mamlatar, who was charged with the collection and remittance of the revenue of the district, and empowered to administer justice in petty complaints""",,508.0
225,128,istighasa,,,indic,legal,128,"""Demanding justice, preferring a complaint.""",,508.0
226,128,istighasa,,,indic,legal,128,"Arabic term means ""appeal for aid.""",,
227,129,banda-nawaza,بنده نوازا,banda-nawāzā,,salutationhonorific,129,"""'Oh you, who treat your slaves with clemency,' formula used as address in letters to the rulers of 19th and early 20th century Bukhara.""",bukhara,282.0
228,129,banda-nawaza,بنده نوازا,banda-nawāzā,,salutationhonorific,129,"""O servant-succoring lord""",,
229,130,kachheri,کچھری,,indic,,130,"""A court, a hall, an office, the place where any public business is transacted.""",,508.0
230,131,qalami shud,قلمی شد,,indic,,131,"""""The words qalamī shud appear to be in answer to be in answer to qalamī numāyand, as if to say that the orders had been duly carried out in drawing up the document.""",mughals,519.0
231,132,mīm,م,,indic,abbreviation,132,"Occurs frequently in Mughal documents. ""We have noticed that sometimes it is placed below the endorsement containing the words muṭlaʿ shud, which suggests that it might be an abbreviation for these words. In that case it would signify something like 'orders recieved'.""",mughals,519.0
232,133,ilaqa,علاقه,,mughal,land_grant,133,"""The ilaqas were the premier group of jagirs. Ilaqa refers to a property or estate... The ilaqas included the estates of Salar Jung, Kishen Pershad, Khan Khanan, and Fakhr ul Mulk. The largest ilaqa in Hyderabad was that held by Salar Jung.""",deccan,
233,134,tuyul,تیول,,,land_grant,134,The term used for the prince's jāgīr here is tuyūl which was in use in Persia from the fourteenth century onwards synonymously with jāgīr. Sometimes tuyūl refers specifically to princely land.,mughals,519.0
234,136,in'am,انعام,,indic,land_grantsuperior_to_junior,136,"""Inʿām ordinarily would mean a gift, a benefaction in general or a gift by a superior to an inferior (Wilson, Glossary, 217)... Since this in'am was to be held on the same basis as jagir but without holding any rank and without any obligation on the part of the grantee (except of course his voluntary 'prayers'), it is evident that in'am in this farman is synonymous with madad-i ma'ash...""",mughals,519.0
235,137,chawki,چوکی,,indic,,137,"""According to Abu Fazl, the four divisions of the army were divided into seven parts, each of which was appointed for twenty four hours to attend upon the Emperor. This mounting [sic.] guard was called 'chauki' in Hindi. For some additional detail of the mounting guard, see Bernier...""",mughals,519.0
236,138,qanun-gu,قانونگو,,indic,taxes,138,"""The primary functions of the qānūngo were related to land and its revenue. The office was almost invariably held for life and generally ran in the family. The qanungo was expected to provide all information on revenue receipts, area statistics, local revenue rates, and practices and customs of the pargana.""",mughals,529.0
237,139,muchalka,مچلکه,,,financialdocument_type,139,لفظی است ترکی به معنی عهدنامه,,8.0
238,139,muchalka,مچلکه,,,financialdocument_type,139,"""A bond, note of hand, agreement, written obligation, recognizance, engagement.""",,528.0
239,139,muchalka,مچلکه,,,financialdocument_type,139,"""Under the administration of the Asaf Jahs there developed a system of farming out administrative subjects like collection of revenue, postal service, or mint service.""",deccan,810.0
240,139,muchalka,مچلکه,,,financialdocument_type,139,"""In its wider application, it signifies an acknowledgment of a possession taken over, and in this respect might have been a counterpart sanad of the baz-nama and the ibra-nama.""",mughals,983.0
241,140,bigar,بیگار,,,,140,"bīgār (بیگار) and ḥashar (حشر): In Central Asia these two terms often appear together to refer to the mobilization of the population for the construction of large buildings, defense works and roads, flushing game on hunts, and agricultural labor, as well as the activities described under qazu and qachu above. These kinds of duties were common on the commoners throughout the Muslim world, and exemption from them was frequently specified in royal edicts. The difference between bīgār and ḥashar are unclear; they are near-synonyms.",transoxania,
242,140,bigar,بیگار,,,,140,"""Bīgār and Shikār: These two rhyming words always appear together... Since it does not appear in the lists of the Abvāb of Fīrūz Shāh Tughluq and that of Akbar... it may be safely presumed that bīgār must have entered India some time in the wake of the Mughals from its land Turkestan, where it remained as a curse of the serfdom under the despotism of the Khanate till the end of the 19th century.""",mughals,983.0
243,141,hashar,حشر,ḥashar,,,141,"bīgār (بیگار) and ḥashar (حشر): In Central Asia these two terms often appear together to refer to the mobilization of the population for the construction of large buildings, defense works and roads, flushing game on hunts, and agricultural labor, as well as the activities described under qazu and qachu above. These kinds of duties were common on the commoners throughout the Muslim world, and exemption from them was frequently specified in royal edicts. The difference between bīgār and ḥashar are unclear; they are near-synonyms.",transoxania,
244,142,kharita,خریطه,,deccan,,142,"""All important letters were received in letter bags (Kharitahs) were brought to the Nizam or taken back by these Mamas [women officials who could enter the harem.""",,535.0
245,142,kharita,خریطه,,deccan,,142,"""A letter bag (Kharitah) had a string running round its mouth. After inserting the outgoing mail inside, the strings were pulled tight and tied up in suitable knots. The ends of these strings were again fixed in a waxed seal.""",deccan,810.0
246,142,kharita,خریطه,,deccan,,142,"in the Rajasthan State Archive this term seems to refer to a kind of document, high-level correspondence; term kharita even used in Rajasthani-language docs.",rajasthan,
247,143,qabala,قباله,,,contract,143,"""any contract of bargain or sale signed by a judge, a bond, a bill of sale, title-deeds, and the like""",india,508.0
248,143,qabala,قباله,,,contract,143,"From Iranica article on Central Asian economy from the Timurids to the 18th century: ""In the legal documents—waqf deeds, sales (qabāla­jāt), court registrations of sales (eqrārāt)—three types of ownership are recognized: private (melk), trust (waqf), and state (mamlaka or mamlaka-ye pādšāhī). Ownership adheres to the individual or entity with the right, conditional or unrestricted, of disposal of prop­erty through sale, gift, bequest, inheritance, or trust.""",,
249,143,qabala,قباله,,,contract,143,qabālāt-i sharʿīya could refer generally to legal documents,mughals,983.0
250,143,qabala,قباله,,,contract,143,"""This is the generic Arabic and Persian term for a legal document, usually one involving an inter-personal contract.""",india,992.0
251,144,yad,یاد,,,equal_to_equal,144,"""a note addressed to an equal on official subjects""",india,508.0
252,144,yad,یاد,,,equal_to_equal,144,"""Yadi (Memorandum): The yadi, yad, or yad-dasht was a memorandum. It derives from the Persian noun 'yad' and verb phrase 'yad dashtan,' which mean 'memory' and 'to remember,' respectively. Mughal chancelleries relied on the yad-dasht to record the details of numerous and wide-ranging administrative operations, from the branding and verification of horses (yad-dasht-i dagh wa tashiha) to the receipt of monies (yad-dasht-i wusul) to the attendance, promotion, and death of soldiers. Local notables and officials verified the information contained in yad-dashts by applying seals and writing endorsements. For example, memoranda on the collection of revenue from lands granted in the Deccan (yad-dasht-i hal wa hasil) featured Marathi endorsements of district-level record-keepers (deshpande). Whereas the Mughal yad-dasht was thoroughly administrative in function, its offshoot genre of yad or yadi in the Maratha Empire was used for both administrative and diplomatic purposes. Maratha rulers exchanged yadis containing the proposed terms and conditions of an anticipated alliance or reconciliation following conflict.""",india,992.0
253,146,zabita,ضابطه,żābita,indic,law,146,"""A rule, a statute, a law.""",india,508.0
254,146,zabita,ضابطه,żābita,indic,law,146,"In Akhlaq literature (e.g. Kashifi), ضابطه is a ""controlling force,"" related to the ruler's punitive capacity (سیاست), and used to uphold the law (شریعه و قانون).",,
255,146,zabita,ضابطه,żābita,indic,law,146,nature of an addendum to a دستور to which it is subordinate,,
256,147,zabt,ضبط,,,,147,"""... taking lands under the management of the government officers...""",india,508.0
257,147,zabt,ضبط,,,,147,in accordance with government law / practice: موافق ضابطه سرکار,deccan,507.0
258,148,ru bi-kari,روبکاری,,indic,law,148,"""The written record of a case, stating the particulars and the grounds of the decision drawn up and authenticated in a Company's court, on passing sentence.""",british,508.0
259,148,ru bi-kari,روبکاری,,indic,law,148,mandamus: a judicial writ issued as a command to an inferior court or ordering a person to perform a public or statutory duty,modern,
260,148,ru bi-kari,روبکاری,,indic,law,148,کسی اعلیٰ عدالت کی جانب سے کسی ماتحت عدالت، حکومت، شرکہ یا عوامی اتھارٹی کو جاری ہونے والے حکم نامہ کو کہا جاتا ہے۔ روبکار میں کوئی کام کرنے (یا نا کرنے) کے لیے ذیلی انتظامیہ کو حکم دیا جاتا ہے جو قانوناً اسے پورا کرنا ہوتا ہے,modern,
261,148,ru bi-kari,روبکاری,,indic,law,148,The ru-bikar-nawis is someone who records legal proceedings: روبکار نویس حکمیکه ناظم در اجلاس صادر فرماید تحریر ان باختیار او ست,deccan,790.0
262,148,ru bi-kari,روبکاری,,indic,law,148,"Nandini Chatterjee (via Elizabeth Thelen): ""They appear to be a colonial form/invention that came into use in Bengal around the 1780s, becoming quite popular in the early 19th centuryThey are somewhat similar to surat-i hal documents, a genre that is seen in earlier periodsThey usually follow a dispute and are often issued by the district commissioner.""",british,
263,148,ru bi-kari,روبکاری,,indic,law,148,"""As a common term used in the office parlance for *proceedings*, it serves as an official order of the divani issued in the names of the local authorities announcing a royal mandate regarding the confirmation of land grants made in previous farmans of the Emperors.""",mughals,983.0
264,149,risala,,,,,149,"glossed as ""troops"" in British report",deccanbritish,543.0
265,150,muhtarifa,محترفه,,,taxes,150,Right of Zamindars documented in Bihar and Bengal during the Mughal period.,mughals,544.0
266,151,kharij az jam,خارججمع,,indic,taxes,151,Lit. outside of the جمعبندی,,
267,151,kharij az jam,خارججمع,,indic,taxes,151,مستغل و املاک مفروز و موضوع از طومارجمعبندی,,8.0
268,152,chawar,چاور,,indic,measurementdistance,152,"""A measure of land, 120 square bighas.""",,508.0
269,153,ra'iat-wari,رعیت واری,,indic,taxesagriculture,153,"""... familiarly applied to the revenue settlement which is made by the government officers with each actual cultivator of the soil for a given term, usually a twelvemonth, at a stipulated money rent, without the intervention of a third party""",british,508.0
270,153,ra'iat-wari,رعیت واری,,indic,taxesagriculture,153,"""it is the mode of assessment which prevails chiefly, although not exclusively, in the provinces of the Madras presidency""",british,508.0
271,153,ra'iat-wari,رعیت واری,,indic,taxesagriculture,153,Active system in the Assigned Districts of Berar,deccan,548.0
272,154,mufassal,مفصل,,indic,province,154,"""in Hindustan, a subordinate or separate district; the country, the provinces, or the stations in the country, as opposed to the Sadar, or principal station or town""",,508.0
273,155,karbari,کارباری,,indic,,155,"""A person conducting affairs, a minister, a public officer, a merchant, a manager, a shopkeeper.""",british,508.0
274,156,hundi,هندی,,,financial,156,"""A bill of exchange.""",india,508.0
275,158,alaman,,,transoxania,,158,"""The principal motivation for recruiting Turkmen into the Uzbek state system was their effectiveness as members of alamans (raiding parties). As we saw earlier, the Turkmen and Uzbek term for a raid itself is chapaaul... The alamans were sometimes very large squadrons that were mustered for the purpose of pillaging and capturing booty, mainly from Persians or Bukharans.""",,
276,159,chaknāma,چکنامه,,indic,land_grant,159,"﻿According to Wilson, a Chaknāma is ""a register of the extent and boundaries of a detached or separate piece of land, or a separate village. A grant authorizing individuals to hold alienated lands, and specifying their limits.""",,508.0
277,159,chaknāma,چکنامه,,indic,land_grant,159,"""Grants of land were usually vague in terms of locational details. Once such a grant was made by the emperor or a noble, local revenue officials and village headmen were tasked with identifying a suitable plot of land, measuring it out, and writing out a document which described the location and adjoining properties. This document was the Chak Nama; the process of such measuring and recording was called 'chakbandi.' The Chak Nama documents was usually witnessed by locals and sealed by a qazi.""",india,992.0
278,160,aliq,آلیق,,transoxania,taxes,160,پایمزد، باج، پولی که لوطیها و جاهلهای هر محل از عروسیها و مجالس مهم می گیرند,bukhara,701.0
279,161,khundighundi,گھںڈی,,indic,,161,دست چوب:... چوب مختصری که سرش خم دارم به شکل چوگان,delhi,702.0
280,162,sijill,سجل,,islam,legal,162,"""the sijill consists of a witnessed record of what the mahdar contained, together with the qadds decision (hukm) on the case""",,
281,162,sijill,سجل,,islam,legal,162,"خبر / گواهی مکتوب ممهور یا ممضی را، ""سجل"" / تصدیق گویند. سند، همانند ترازوی دو کفه ای، ""متن"" و ""سجل"" دارند",,
282,162,sijill,سجل,,islam,legal,162,can refer to the endorsement of a document,,
283,162,sijill,سجل,,islam,legal,162,"""A sijill is the judgment of a bench of qadis and a mufti acting as jurisconsult bearing the seal impressions of the bench and attestations of the witnesses. It contains a concise statement of the case, the points of determination, the particulars of the claim, the decision thereon and the reason for such decision (fayṣala).""",mughals,983.0
284,162,sijill,سجل,,islam,legal,162,beginning of such a verdict: الحال هیچ دعوی مدعیان مذبور از وجه مذبور نماند، این چند کلمه نوشته شد که وقت حاجت باشد فی التاریخ حکم شد که بدستور سابق قابض و متصرف باشد تحریر تاریخ,mughals,983.0
285,163,mahzar,محضر,,islam,legaldocument_type,163,"""The mahdar refers to any of two different types of document: (1) a statement made by witnesses to the effect that someone has, for instance, sold, bought, pledged or acknowledged something. 'It consists of that upon which the judge's decision is based'; (2) a record of the two parties' actions and claims taking place in the presence of the qadd, who must sign it before witnesses in order for it to be complete.""",,
286,163,mahzar,محضر,,islam,legaldocument_type,163,"""Most of them relate to grievances of an area, especially, restoratin of madad-i-maash grants or a request from the grantees for non-interference of revenue officials in their grants.""",mughals,
287,163,mahzar,محضر,,islam,legaldocument_type,163,"""Before the matter was finally settled in favour of the heir, in view of some dispute that might crop up in regard to his title, the jagirdar or the nuvvab of the pargana executed a document attested by the qadi and other witnesses to bear testimony to the confirmed possession of the old grant in favour of the recipient of the relevant documents. It was just like a public recognition of the possession by the heir thereof... The details were recorded in the form of a mahdar-nama which was attested by the seal of the qadi and signed by the witnesses.""",mughals,983.0
288,163,mahzar,محضر,,islam,legaldocument_type,163,"""Mahzar Nama (Collective Testimony): A Mahzar Nama is similar to an affidavit. It consists of a statement of facts regarding a property, a person or certain events, solicited by specific persons, and attested to by their professional and social associates. Such a document was usually prepared in the context of a legal dispute, sometimes to replace missing or damaged legal deeds. It was nearly always sealed and verified by an Islamic judge, a qazi. Mughal Mahzar Namas often began with a quote from the Quran exhorting witnesses not to conceal testimony. They were different from mahzars in the Marathi-writing parts of the country, which were records of decisions made by judicial assemblies. In Sunni Hanafi legal texts such as the imperially sponsored Fatawa-yi Alamgiri, mahzars are similarly described as documents that recorded the proceedings of a legal dispute.""",india,992.0
289,164,sukuk,صکوک,,,financial,164,"""Sukuk, which include contracts of sale, pledges, acknowledgements, gifts, donations and other instruments, including adhkdr huquq. These are also known as hujjas and wathiqas, although they also refer, as Ibn Nujaym states, to mahddir and sijillat.""",,
290,167,nadiri,نادری,nādirī,iran,money,167,"In late 18th-century Iran: ""The main currencies were the Indian gold rupee, the Persian silver rupee, and the silver naderis"" (Floor, “The Persian Economy in the Eighteenth Century,"" 145).",iran,
291,168,mazar'i,مزارع,,,,168,"""hamlet"" as compared with قریه, ""village""",iran,715.0
292,169,daymi,دیمی,,,agriculture,169,"""Nurtured by rain only (sown fields).""",,716.0
293,171,isqat,اسقاط,,,law,171,"﻿""the parties agreed on the exclusion of legal legal actions concerning all rights of withdrawal"": ﻿طرفین اسقاط جمیع خیارات فسخ گردید",iran,715.0
294,172,salghut,سلغوت,,khorezm,taxes,172,"""The first two Qonghrat khans, who ruled the khanate of Khiva from 1804, introduced a new system of taxation. The land tax (salghut) in monetary form was imposed on all landowners, who were divided into three categories according to the size of their lands...""",khorezm,
295,174,nuri,نوری,nūrī,transoxania,agriculture,174,Attested in manuscript sources as well: [ان ایشان] را بنورکشی فرموده اند و به خر نوری کشانیده اند,bukhara,232.0
296,175,insan-i kamil,انسان کامل,,,sufiphrase,175,title assumed by Akbar,mughals,
297,177,paranji,,,transoxania,,177,Formally banned in 1947.,,
298,179,fatwa,فتوی,,islam,law,179,"""In the post-Stalin period, however, the meaning of the term underwent a process of change whereby it came to denote an Islamic legal “ruling” (Uzb. buyruq), or at least this is the way in which Uzbeks referred to SADUM’s fatwas between the 1960s and the 1980s... This change in meaning should not come as a surprise for, as early as the 1940s, CARC itself began to refer to fatwas as shariatskie ukazy (Rus. “sharia-based resolutions”)""",soviet,
299,180,patta,,,soviet,soviet,180,"Soviet Islamic genre of citizen religious questions: ""Such letters vary in generic composition ranging from questions of Islamic jurisprudence and issues of ethics to complaints about specific fatwas issued by SADUM and conflicts among various religious groups in Uzbekistan. Interestingly, some of them include answers (Uzb. javob), often formulated in Soviet Uzbek bureaucratese and thus in an exceedingly laconic fashion, which the Spiritual Board issued to its appellants.""",,
300,180,patta,,,soviet,soviet,180,deed,india,936.0
301,180,patta,,,soviet,soviet,180,this is different from a permanent revenue grant; the holder has leased the rights to a piece of land; used internally by the Rajputs,india,
302,181,sayl,سیل,,islam,ritual,181,"""Sayil (lit. ‘flowing’) is a term used to denote a complex of celebrations, devotional rites, and fares held during Muslim saints-day festivals in the vicinity of Muslim shrines. They were usually held in spring, after the Nouruz (the New Year according to the Iranian calendar) and in autumn.""",transoxania,
303,181,sayl,سیل,,islam,ritual,181,"""In the Soviet period during sayils Muslims travelled across republican borders to perform the ritual visitation to a shrine and live there in communities, also for several weeks.""",soviet,
