,UID,Term,Emic_Term,Translit,Scope,Tags,JoinKey,Def,Spec,Source
0,1,qonalgha,قونالغه,,transoxaniakhorezm,military,1,"A term found in documents thoughout the Turko-Mongol world in various forms, all of which are derived from qonmoq. It refers to the obligation of the rural populace to billet state officials and military personnel in their homes for a rest or for the night, providing them with food and entertainment, as well as provisions for the next day's journey. The billeting duty is described as one of the heaviest obligations imposed on the common people, even being referred to as a 'national disaster' in Ilkhanid Iran.",,
1,1,qonalgha,قونالغه,,transoxaniakhorezm,military,1,"""This Turkish word which appears in the Farmans of the Mughals with mutilated spellings sometimes, has given rise to very interesting interpretations... It has been translated (i) 'daily allowance and lodging of envoys going backward and forward', and (ii) 'allowance and lodging.'""",,983.0
2,2,jarib,جریب,,transoxania,agriculturemeasurement,2,"""Jarīb was the former land measure, also the measuring instrument in yards, and bīgha was the name applied to jarīb.""",,983.0
3,2,jarib,جریب,,transoxania,agriculturemeasurement,2,"A unit of measure, both of volume and of land. Can also be used to refer to a tax on a given measure of land (جریبانه).",,
4,3,tanabana,طنابانه,ṭanābānatạnāp,transoxania,taxes,3,"This tax was ""calculated on the basis of the cultivated surface (measured in tạ nāp, or tanap in Russian), and pro-rated according to the kind of crop, not according to the annual harvest.""""There is no uniformity either in sources or historiography on the size of a tanap; approximately, it amounted to between one-fourth and one-sixth of the Russian desyatina.  e latter being 1,09254 ha, a tanap would be 0.18 to 0.27 ha.""",ferghana,280.0
5,3,tanabana,طنابانه,ṭanābānatạnāp,transoxania,taxes,3,"""Tạnāp was reportedly paid on orchards, gardens, and vineyards that required more labor and long-term investments but were more remunerative than cereal crops.",ferghana,280.0
6,3,tanabana,طنابانه,ṭanābānatạnāp,transoxania,taxes,3,ماليات بر باغها و تاكستانها از هر طناپ مربع در خجند برابر بود,transoxania,283.0
7,3,tanabana,طنابانه,ṭanābānatạnāp,transoxania,taxes,3,report comparing khiraj and tanabana in Bukhara (1910),bukhara,299.0
8,4,tarkhan,ترخاندرخان,tarkhān,khorezmtransoxania,taxesproperty,4,واژهاي كهن؛ امتياز معافيت ماليـاتي، بـراي يـكشخص يا آبا و اجدادي ]براي ده نسل يا هميشه[، كسي كه اين معافيت را داشـت  از امتيازهاي ديگري هم برخوردار بود، بهويژه براي 9 جـرم محاكمـه و محكـوم نمي شد، يا حق ورود به كاخ خان را بدون اجازة خاص دارا بود,,283.0
9,5,yap,جیب,,khorezmtransoxania,irrigation,5,Artificial trench for irrigation.,khorezm,273.0
10,5,yap,جیب,,khorezmtransoxania,irrigation,5,جيب: گودال، سنگر,ferghana,283.0
11,6,kaywan, کیوانی چوریشان,kaywān,bukharatransoxania,women,6,"regional (областное) term for a woman who is in charge of the table and dishes during weddings; домохозяйка (house wife); высокая терасса, веранда (фольклёрное)",,
12,8,barat,برات,barāt,iranqajartransoxania,taxes,8,چيزي كه بايد داده شود,,283.0
13,8,barat,برات,barāt,iranqajartransoxania,taxes,8,از فعل برمق، یعنی دادن - یک گواهی،‌به ویژه از گرد آورندۀ مالیات,,283.0
14,8,barat,برات,barāt,iranqajartransoxania,taxes,8,"письменное предприсание: ""для сбора податей, правитель командирует кого нибудь из своих служителей, снабдив его письменных предписанияем (берат) на имя того места, откуда требуется подать.""",,307.0
15,8,barat,برات,barāt,iranqajartransoxania,taxes,8,"""Tribute tax... It was payable - in proportion to each group's population - in either sheep or grain""",transoxania,
16,8,barat,برات,barāt,iranqajartransoxania,taxes,8,"""Sometimes, the families of captives [taken by Turkmen raiders] would send coins and promissory notes (called bar ̄at) via caravans traveling from Iran, which merchants from the caravans would exchange for their loved ones.""",iran,764.0
17,8,barat,برات,barāt,iranqajartransoxania,taxes,8,"""deed of appointment, or grant of privilege""",ottomans,
18,9,awzak,اوزک,awzakauzak,indicmughal,seal,9,"""According to Abu al-Fazl, this seal was used, among other things, for سیورغال grants. During Jahangir's reign at one time, the فرمان were sent to the imperial harem to be sealed with the auzak, for according to Abd al-Hamid Lahori this seal was then kept by the Empress.""",mughals,519.0
19,10,mutabiq bi-aslihi,مطابق باصله,muṭābiq bi-aṣlihi,,,10,"glossed as the Latin ""vidimus"": an official or legal inspection (as of a document); an attested copy of a document",,
20,11,aima,اَیمہ,,mughalindic,land_grant,11,"""Land granted by the Mogul Government, either rent-free or subject to a small quit-rent, to learned and religious persons of the Mohammedan faith, or for religious and charitable uses in relation to Mohammedanism. Such tenures were recognised by the British Government as hereditary and transferable.""",mughals,508.0
21,11,aima,اَیمہ,,mughalindic,land_grant,11,"""... towards the close of Aurangzeb's reign a'imma was treated as a hereditary property that could be leased out.""",mughals,529.0
22,12,bigha,بيگهابیگههबीघा,,indicmughal,measurement,12,"This term active in revenue documents during Akbar's time, e.g. in year 979/1571.",,519.0
23,13,cho'ri,چوری,,transoxania,womenservantsslavery,13,,,94.0
24,13,cho'ri,چوری,,transoxania,womenservantsslavery,13,,,96.0
25,13,cho'ri,چوری,,transoxania,womenservantsslavery,13,used in conjunction with ghulam: غلام چوری,,1089.0
26,13,cho'ri,چوری,,transoxania,womenservantsslavery,13,بالا خىزمەتچى,xinjiang,1091.0
27,13,cho'ri,چوری,,transoxania,womenservantsslavery,13,"چوره: خدمتکار مرد باشد که آنرا ""محرم چوره"" نامند",,1090.0
28,13,cho'ri,چوری,,transoxania,womenservantsslavery,13,female slave; still in common use in Uzbekistan,,
29,13,cho'ri,چوری,,transoxania,womenservantsslavery,13,невольныца,,1143.0
30,14,kharaj,خراج,kharāj,islam,agriculturetaxes,14,"""generally corresponded to a one-fifth share of the crop""",ferghana,280.0
31,14,kharaj,خراج,kharāj,islam,agriculturetaxes,14,"""In 1873 the old Bukharan system was simplified: besides zakāt, there only remained tanap and kheradzh. Kheradzh itself was reduced by half of what peasants had supposedly paid under the emir, corresponding now to only 10 percent of the crop, also on irrigated land.""",bukharasamarqand,280.0
32,14,kharaj,خراج,kharāj,islam,agriculturetaxes,14,"""Land / produce tax which in Central Asia eventually came to mean basically 'one fifth of produce or its value in money'"" ",,280.0
33,14,kharaj,خراج,kharāj,islam,agriculturetaxes,14,ماليات اسلامي بر زمـين، يـك پـنجم سـهم غلـه اززمينهاي آبي و يك دهم زمينهاي ديمي )قزاقان در تاشكند برخي از خواجگان و شيخها را از خراج معاف كردند و آنان را معلمان و مرشدان، خور كردند,transoxania,283.0
34,14,kharaj,خراج,kharāj,islam,agriculturetaxes,14,"""харадж 10-ю часть с жатвы""",tashkent,286.0
35,14,kharaj,خراج,kharāj,islam,agriculturetaxes,14,report comparing khiraj and tanabana in Bukhara (1910),bukhara,299.0
36,15,bogara,,bahārī,transoxania,agriculture,15," ""The first [kind of crop] was collected on tilled land, both irrigated (ābī) and rain-fed (lalmī), under wheat, sorghum, rice, etc. Russian sources define rain-fed land more often as bogara, although this term, derived from the local bahārī, properly refers to rain-fed land sown with spring wheat.",ferghana,280.0
37,16,zakat,زکات,zakāt,islam,taxestrade,16,"""In the countryside, livestock was the basis to calculate zakāt, the general tithe on economic activities.""",ferghana,280.0
38,16,zakat,زکات,zakāt,islam,taxestrade,16,"1/40th of profits: ""1 руб. с 40 р. дохода""",tashkent,286.0
39,16,zakat,زکات,zakāt,islam,taxestrade,16,"Trade tax: ""На прощании г. токсаба обещал сам придти на закет, т.е. на ревизию товаров когда они придут.""",bukhara,995.0
40,17,quruq,قرققوروق,qūrūq,transoxania,agricultureproperty,17,"""the khan’s land constituted a distinct category: it included the khan’s fallow land (qūrūq)""",ferghana,280.0
41,17,quruq,قرققوروق,qūrūq,transoxania,agricultureproperty,17,منع و بازداشت,,8.0
42,17,quruq,قرققوروق,qūrūq,transoxania,agricultureproperty,17,In Mughal documents can refer to removing someone from office.,mughals,
43,17,quruq,قرققوروق,qūrūq,transoxania,agricultureproperty,17,"""a Mongol term referring to something restricted, embargoed""",mongols,
44,18,chek,چیک,chēk,transoxania,agricultureproperty,18,"""the khan’s land constituted a distinct category: it included the khan’s fallow land (qūrūq), newly irrigated land reclaimed at the khan’s expense (chēk), and other plots that were privately owned by the khan and his family, often cultivated as gardens and orchards, known as khāsạ or khāsạ̄gī""",ferghana,280.0
45,19,khasa,خاصه,khāsạkhāsạ̄ gī,persianate,agricultureproperty,19,"""other plots that were privately owned by the khan and his family, often cultivated as gardens and orchards""",ferghana,289.0
46,19,khasa,خاصه,khāsạkhāsạ̄ gī,persianate,agricultureproperty,19,"""crown lands used to pay for the upkeep of the royal court and bureaucracy""",iran,
47,20,aq waqf,,āq waqf,transoxania,property,20,"""some of them were exempted from land-tax (āq waqf), others (qarā waqf) were subject to the latter""",ferghana,280.0
48,21,qara waqf,,qarā waqf,transoxania,property,21,"""some of them were exempted from land-tax (āq waqf), others (qarā waqf) were subject to the latter""",ferghana,280.0
49,22,milk,ملک,,islam,property,22,"""the bulk of tilled land was subdivided between the oft-disputed categories of mulk and amlāk. Mulk land could be exempted from the payment of land-tax (and was, in these cases, denominated mulk-i ḥurr), or subject to it (mulk-i kherāj). Amlāk, on the other hand, was subject to the payment of kherāj and, if not assimilated to state land altogether, was associated with somewhat weaker property rights in comparison to mulk.""",,280.0
50,22,milk,ملک,,islam,property,22,"""Beisembiev and Nabiev agree that, under the reign of the last Khan, Khudoyar, tax-free mulk land had become a blurred category, both because of the dispersion of previously existing spe- cial land rights and because the last khans had collected land-tax on all of them, whilst creating other kinds of exemptions.""",,280.0
51,24,mulk-i kharaj,ملک خراج,,islam,property,24,"""the bulk of tilled land was subdivided between the oft-disputed categories of mulk and amlāk. Mulk land could be exempted from the payment of land-tax (and was, in these cases, denomi- nated mulk-i ḥurr), or subject to it (mulk-i kherāj). Amlāk, on the other hand, was subject to the payment of kherāj and, if not assimilated to state land altogether, was associated with somewhat weaker property rights in comparison to mulk.""",,280.0
52,25,mulk-i hurr,ملک حر,,islam,property,25,"""the bulk of tilled land was subdivided between the oft-disputed categories of mulk and amlāk. Mulk land could be exempted from the payment of land-tax (and was, in these cases, denomi- nated mulk-i ḥurr), or subject to it (mulk-i kherāj). Amlāk, on the other hand, was subject to the payment of kherāj and, if not assimilated to state land altogether, was associated with somewhat weaker property rights in comparison to mulk.""",,280.0
53,25,mulk-i hurr,ملک حر,,islam,property,25,"""molki or private property, which represented the smallest part of landholdings, mostly held by absentee landlords""",,
54,26,amlak,املاک,,islamtransoxania,property,26,амлекдарство: уезд,bukhara,707.0
55,27,farman,فرمان,,persianate,royaldecreesuperior_to_junior,27,"""This consists of the royal orders and missives in which the addressee is either a member of the royal family, a noble or official of the State, a feudatory or ruling prince under the vassalage of the Mughal dynasty, or any other individual of the State, except the privileged persons such as sufis and saintly-scholars, who receive and write Maktub from and to the Emperor"" ",mughals,281.0
56,27,farman,فرمان,,persianate,royaldecreesuperior_to_junior,27,"""The tughra and the royal seal, with the exception of a few edicts, are the inevitable features of the faramin-i-sultani""",mughals,281.0
57,27,farman,فرمان,,persianate,royaldecreesuperior_to_junior,27,"in the Mughal context, the farman ""... covers both categories of royal orders, i.e. personal orders of the Emperor and chancellary orders. For the sake of convenience we call them (A) Farman-i-sultani, and (B) Ahkam-idivani.""",mughals,281.0
58,27,farman,فرمان,,persianate,royaldecreesuperior_to_junior,27,"A crucial element is that the farman signifies a degree of sovereignty: ""A farman is a public and legislative document promulgated in the name of the ruler or another person (e.g. prince, princess, governor) holding partial elements of sovereignty.""",,
59,27,farman,فرمان,,persianate,royaldecreesuperior_to_junior,27,"In the early Asaf Jahi period, only the Mughal Emperor issued farmans, which were received by the Nizam: ""There is no indication on these documents that these letters evern meant to be called Firmans by the court of Darul Insha of Delhi. It is indicative of the respectful attituded of the Nizam for the court of Delhi, that these letters were maintained in his Darul Insha as Firmans and not as letters (Khat); the letter have been maintained as a different category of documents.""",deccan,810.0
60,27,farman,فرمان,,persianate,royaldecreesuperior_to_junior,27,"""These were imperial orders. The name derived from the Persian verb ‘farmudan’, to order. In evidence from at least the Saljuk period (10th-12th centuries CE), farmans developed specific styles and conventions in the Ottoman, Safavid and Mughal empires, and distinct sub-types depending on the content and context of the order. For example, in the fifteenth century, the famous Ahmadnagar courtier Mahhmud Gawan described the eight pillars (features) of a farman. In the sixteenth century, the chief Mughal courtier, Abul Fazl, described two different kinds of farmans in use; the farman-i zabti and farman-i bayazi; the former used for at least three different purposes. Collections of farmans reveal clear differences in layout, seals, calendars and the use of set phrases between the Mughal and Bijapuri farmans. Farmans tended to be vague on details, and hence often had very detailed notes on the verso (zimn). They were also elaborated through supplementary orders from various grades of officials.""",india,992.0
61,28,tughra,طغرا,,,seal,28,علامت شخصي عالي حاكم، فرمان,,283.0
62,28,tughra,طغرا,,,seal,28,"By the time of Jahangir, Mughal tughras are more often in a square format; the more famous Ottoman ones are in a circular format; Safavid ones were also square, and may have been the inspiration for the Mughal ones. (However, the square shape was not an invention of the Mughals; there are examples going back to the Jalayirids, and there may well have been Chinese influence in the shape, via the Mongols.)",mughals,
63,28,tughra,طغرا,,,seal,28,"There was a special person in charge of scribing the Tughra known as the tughra-nawis, who effectively certified the farman.",mughals,
64,28,tughra,طغرا,,,seal,28,"When reading a tughra, there are no rules or internal logic for word order or direction (unlike seals); any word or letter can appear anywhere (at least on Indic tughras).",mughals,
65,29,farman-i bayazi,,,indic,royaldecree,29,"""The farman issued directly by the Mughal emperor without passing through the elaborate procedure and routine of the daftars, for urgent an important matters demanding an immediate execution, is known as farman-i-bayadi. It was sealed in a particular way and put in a golden cover preventing its confidential contents from being seen, and was despatched forthwith to the address through a trustworthy servant of the court""",mughals,281.0
66,30,qawl-nama,قولنامه,qawl-nāma,indic,diplomacy,30,"""A qaul-nama (Kaool-nama of the East India Company) is the unilateral executed engagement or a promise for political purpose. Such qaul-namas were very common during the period of the East India Company executed for the local Nabobs and Rajas""",mughalsbritish,281.0
67,30,qawl-nama,قولنامه,qawl-nāma,indic,diplomacy,30,this genre could be a treaty; but more often it was a revenue agreement,india,
68,30,qawl-nama,قولنامه,qawl-nāma,indic,diplomacy,30,"""Qaul Qarar (Tax Contract): These were contracts between village landlords and imperial tax officials or jagirdars, for the payment of the agreed amount of revenues into the treasury of the state or the jagirdar. In the Mughal period, these documents often started with the words 'qaul qarar patta-yi ijara', indicating the leasing out (ijara) of tax collection duties. In colonial times, they came to be termed ‘cowles’ and were handed to significant villagers by district officials. These documents were frequently bi-lingual - Persian and the local language, and often use siyaq numerals to indicate the amount payable.""",india,992.0
69,31,ramz,رمز,ramz,indic,royal,31,"""It denotes a short note of the Emperor in his own hand. The ramz and ishara are in fact short notes and points put down by the Emperor himself in his diary, or dictated to his munchis to be used as materials for the official correspondence, after""",mughals,281.0
70,32,manshur,منشور,manshūr,islam,legalroyal,32,"""A diploma of approbation conferred on religious authorities or the clergy, such as qadis and muhtasibs, as a token of reverence accorded to them by the kings... a specific term for a royal missive and a mandate in which the mursal-ilayhi is a privileged person belonging to the Royal family or the ruling class. It forms the subjects of congratulations and condolence, famous and privileges, or private and official affairs""",mughals,281.0
71,32,manshur,منشور,manshūr,islam,legalroyal,32,"In the Fatimind and Ayyubid contexts, this meant ""an 'open decree' having no address and delivered to the beneficiaries, instead of being sealed and posted to the authorities whom it concerned... it is written on a long scroll made up of a number of sheets glued together at their shorter side.""",arab_world,
72,32,manshur,منشور,manshūr,islam,legalroyal,32,"""The manshur of the Mughals, like its counterpart the farman, appears commonly as an honorary epithet... Under the Mughals, the manshur, however, signifies a specific term for a royal missive and a mandate in which the mursal-ilayhi is a privileged person belonging to the Royal family or ruling class. It forms the subjects of congratulations and condolence, famous and privileges, or private and official affairs... The manshur, as defined above appears to have been for some time in abeyance, until it emerged, at the turn of history, as a distinct royal order of a sovereign de facto awaiting the ceremony of his coronation.""",mughals,983.0
73,34,madad-i ma'ash,مدد معاش,madad-i maʿāsh,indic,property,34,"""The office of Sadr was basically concerned with charitable grants popularly known as madad-i maash.""",mughals,
74,34,madad-i ma'ash,مدد معاش,madad-i maʿāsh,indic,property,34,"""Since madad-i macash grants were, in theory, revocable by the state, Akbar might well have withdrawn them to encourage the combatants to make peace. He did not, which indicated that madad-ma’ash well have been treated as awqaf even though the state's bureaucracy did not employ that term""",,
75,35,arazi,اراضی,,islam,property,35,"""Plots of land as objects of transactions, such as grants, sale, lease.""",bukhara,282.0
76,36,dahdu,دهدو,dahdū,,taxesagriculture,36,"""basically one fifth of produce""",bukhara,282.0
77,37,hukm,,,islam,royaldecree,37,"""Decision, decree, issued by a ruler, as in the intitulatio formulae ḥukm-i ʿalī shud or ḥukm-i jahān-muṭāʿ shud.؛",,282.0
78,37,hukm,,,islam,royaldecree,37,"ḥasb al-ḥukm were orders to the ministers from the center ""covered a large variety of state and administrative matters""; contrast with ḥasb al-amr, which referred to orders issued by regional officials",,983.0
79,37,hukm,,,islam,royaldecree,37,ḥukm-nāma: used to refer to orders handed out by the Political Agency in Bukhara,bukhara,1214.0
80,37,hukm,,,islam,royaldecree,37,ḥukm-nāma: постановление,bukhara,1210.0
81,39,mu'ad,معاد,muʿād,islam,financiallegal,39,"""Term of recurrent payment in rentals and leases.""",,282.0
82,40,mubarak-nama,مبارکنامه,,,royaldocument_type,40,"""Decision of the ruler in (positive) response to a petition.""",bukhara,282.0
83,40,mubarak-nama,مبارکنامه,,,royaldocument_type,40,Example of going to Karmina to get such a document from the Amir: فقرایان بکرمینه برکاب نصرت انتساب عالیمولایم رفته یکمبارکنامه بنام غلامشان امیر قل یک اشیک اقا باشی و ایندعاگوی از برای استیفا آوردند,bukhara,979.0
84,41,iqrar,اقرار,iqrār,islam,financiallegal,41,"""Public acknowledgment, declaration or deposition made by the vendor in deeds of sale...""",,282.0
85,41,iqrar,اقرار,iqrār,islam,financiallegal,41,"""An iqrar was a legally binding declaration (sometimes translated as ‘confession’) in Islamic law, and hence of highest probative value. Document recording such declarations also came to be called iqrars or iqrar-namas, and were used to record sales, debts and other inter-personal transactions. These were inevitably sealed by the qazi. In the Indian sub-continent, they were frequently bi-lingual, and included multiple attestations in the margins of the documents, also in various scripts and accompanied by seals and symbols. It appears that in the Arabic-writing parts of the Indian Ocean, iqrars came to be used primarily as record of debt.""",india,992.0
86,42,nishan,نشان,,,decreedocument_typesuperior_to_junior,42,"""Decree, order, and one of the terms used to refer to them in the documents themselves.""",bukhara,282.0
87,42,nishan,نشان,,,decreedocument_typesuperior_to_junior,42,"Essentially, these are Farmans issued on behalf of the sovereign by someone else - and hence cannot be called a farman. However, in the Dar al-Insha of the early Asaf Jahis, these are nevertheless classified as farmans.",deccan,810.0
88,42,nishan,نشان,,,decreedocument_typesuperior_to_junior,42,"close in meaning to the chak-nāma: ""In some cases of chak-bandī, a nishān of the prince would act as the final authority for the execution of the grant.""",mughals,983.0
89,42,nishan,نشان,,,decreedocument_typesuperior_to_junior,42,"""A nishan was a Mughal term for orders issued by princes of the royal house, or by some exceptionally powerful queens and princesses.""",india,992.0
90,42,nishan,نشان,,,decreedocument_typesuperior_to_junior,42,орден (another meaning is 'medal' or 'decoration'),bukhara,1356.0
91,43,qibla-gah,قبله گاه,,,,43,"""'Place [acting as] qibla,' formula used to address men older than the writer (in private and official letters).""",,282.0
92,44,uskuna,اسکنهسکنیات,uskunasukniyāt,,property,44,"""Any kind of property produced by human labor on a given plot of land: plants, trees, buildings and so forth. Can form the object of a transaction separately from the land itself.""",transoxania,282.0
93,45,tasadduq,تصدق,,transoxania,,45,"""Sacrifice. Used in the formula (p) taṣadduq-i sar-i mawlāyam shawam, 'Let me be the sacrifice offered for my master's head,' used as address in letters written to the rulers in late 19th - early 20th century Bukhara.""",bukhara,282.0
94,46,yarliq,یرلیقیرلیغ,,,royaldecreedocument_type,46,"""Decree issued by the ruler.""",transoxania,282.0
95,46,yarliq,یرلیقیرلیغ,,,royaldecreedocument_type,46,"Features of a Yarliq: ""All its elements are present: the invocation, the intitulation, the formula of public promulgation, the addressee, the disposition and so forth, and at the end, as part of the eschatocol, the date and the seal imprint.""",transoxania,282.0
96,47,nazr,نذر,,,royalsubordinate_to_superior,47,"Company official Buckley ""noted that the company had maintained its ritual subordination to the body of the emperor by presenting offerings (nazr) upon gaining a royal audience and accepting robes of honors (khil'at) at least until 1843, what it abandoned these practices.""",british,
