,UID,Term,Emic_Term,Translit,Scope,Tags,JoinKey,Def,Spec,Source
426,275,hal u istiqbal,حال و استقبال,,indic,formula,275,"Though استقبال means ""welcome"", in this context of the formula it refers to the future.",,
427,277,qit'aa,قطعه,,,agriculture,277,"Qit'aa is quite often used to mean a piece of land specifically, and therefore often followed by زمین",india,
428,277,qit'aa,قطعه,,,agriculture,277,участка,bukhara,1060.0
429,278,khilafat-martabat,خلافت مرتبت,,indic,honorific,278,"This term was used to refer to Mughal emperors in documents; however, it meant ""rank equal""; they were careful not to actually claim the rank of Caliph, which was left to the Ottomans.",mughals,
430,279,sad,ص,,,abbreviation,279,"﻿""The letter ص, which is of frequent occurrence in Mughal official documents, stands for sādiq, i.e. 'true, genuine, authentic'. It is generally taken to stand for sahai which also connotes, among other things, 'true' and 'authentic'.""",mughals,529.0
431,280,dam,دام,dām,,financialmoney,280,Can refer to a unit of land measurement.,india,
432,280,dam,دام,dām,,financialmoney,280,"A copper coin, less valuable than a rupee, (e.g. مبلغ ___ دام).",india,
433,281,abad-muddat,ابد مدت,,,honorific,281,Often modifying دولت: e.g. بدعای بقای دولت ابد مدت,mughals,
434,282,taghir,تغییر,,,,282,Often used in official Mughal documents to refer to the replacing of one official with another.,india,
435,283,arz u chahra,عرض و چهره,,,document_type,283,Description of the appearance of a person for the purposes of military recruitment and attendance.,mughals,
436,283,arz u chahra,عرض و چهره,,,document_type,283,These documents usually have the following heading: عرض و چهره ملازمان درگاه خلایق پناه,mughals,
437,284,dargah-i hala'iq-panah,درگاه خلایق پناه,,,royalformula,284,For instance arz u chahra documents usually begin with the following formula: These documents usually have the following heading: عرض و چهره ملازمان درگاه خلایق پناه,mughals,
438,285,jib-i khass,جیب خاص,,,royalfinancial,285,A fund for the king's personal usage.,india,
439,287,naw-nihal,نونهال,,,,287,Newly born children (attested in Delhi roznamcha).,,
440,287,naw-nihal,نونهال,,,,287,درخت جوان,,8.0
441,289,hundwihundi,هندیهندوی,,indic,financial,289,"""bill of exchange, money order""",india,528.0
442,290,haweli,حویلی,,,,290,"A mansion granted to high-ranking nobles. (E.g. Mughal princes had havelis.) They were large: had stables, often a place for elephants, servant quarters, etc.",india,
443,291,naqd,نقد,,,financial,291,"""fifty rupees cash"": پنجاه روپیه نقد",india,
444,292,siyaha,سیاهه,,,financialdocument_type,292,"""An account-book; a written account; a list, an inventory.""",,528.0
445,292,siyaha,سیاهه,,,financialdocument_type,292,"There are also hastily scrawled documents that seem to be a different genre or sub-genre, called the siyaha-huzur, which records audiences with the emperor.",,
446,292,siyaha,سیاهه,,,financialdocument_type,292,وعی از دفتر و حساب و آنرا روزنامه نیز گویند و در آن تفصیل اسباب خانه و رخوت و لباس باشد نویسند,iran,8.0
447,292,siyaha,سیاهه,,,financialdocument_type,292,"""'Siyāha Ḥużūr': It is a diary of day-to-day happenings at the Court, and includes such items as the time of public and private audience, orders in regards to grants, complaints, and various administrative matters."" Subahdars kept these in the provinces, for instance.",mughals,962.0
448,293,raqam,رقم,,,decreesubordinate_to_superior,293,"﻿In general, in the Qajar system a farmān was a decree issued by the monarch, while a raqam was a decree issued by a prince.",iran,
449,294,zamir-i munir mihr-i tanwir,﻿ضمیر منیر مهر تنوير,,,honorific,294,"﻿""a mind as bright as the sun""",,
450,294,zamir-i munir mihr-i tanwir,﻿ضمیر منیر مهر تنوير,,,honorific,294,"﻿""A mind mixed or leavened with friendship.""",,
451,296,mawajib,مواجب,,,financial,296,یکهزار تومان از مواجب انمرحوم را در حق معمد السلطان مؤتمن الخاقان میرزا مصطفی خان نایب اول وزارت خارجه مقرر,iran,857.0
452,297,urf,عرف,,,,297,"can refer to a lineage, e.g. the Urf of Qurayshi: ﻿لاد محمد ولد مهر علی ابن راجا عُرف قریشی",india,876.0
453,298,mutamam,متمم,,,diplomatics,298,متمم / تکمله در فرهنگنامه به معنی تمام کننده، کامل کننده و ضمیمه است,,896.0
454,299,tasdiq,تصدیق,,,,299,"""It served as an attested copy for further order in that regard, and repeated teh stages of the yād-dāsht and the taʿlīqa. It was then sent to the office of the bakhshī for inspection.""",mughals,983.0
455,299,tasdiq,تصدیق,,,,299,"""Tasdiq (Note of Verification): Various kinds of verification notes were produced by Islamic judges (qazis) and other officials in the Mughal empire. Sometimes, a tasdiq was produced to check and validate a copy of an older deed. In other cases, paymaster-general of the army (bakshi) issued tasdiqs to verify the number of soldiers in the employ of a noble on provincial duty.""",india,992.0
456,300,ta'affun,تعفن,taʿaffun,,health,300,"Appears in Bukharan documents in relation to ""fetid pits"" (چقور تعفن ناک).",bukhara,844.0
457,300,ta'affun,تعفن,taʿaffun,,health,300,Sometimes misspelled by Russian-employed scribes: چقور تأفون ناک,bukhara,844.0
458,301,sar-salamati,سرسلامتی,,,document_type,301,letter of condolence,iran,
459,302,wali-ahd,ولیعهد,,,royal,302,عبد الاحد خان بحکم ولیعهدی از بین اخوان پادشاه شد,bukhara,900.0
460,303,mazbata,مضبطه,,ottomanqajar,document_type,303,"In the Ottoman empire, this was a report compiling questions and answers.",ottomans,
461,303,mazbata,مضبطه,,ottomanqajar,document_type,303,,iran,904.0
462,304,rafizi,رافضی,,,,304,"Used by scholars to refer to Shi'a; however, not as ""legalistic"" a term as kāfir, for instance.",,
463,305,al-taqsir,التقصیر,,,,305,"""forgive me for my miserable mistakes""",,
464,306,fuqara,فقرا,,,subjecthood,306,subject (i.e. of a state) (example of usage to close to modern Uzbek meaning),transoxania,934.0
465,306,fuqara,فقرا,,,subjecthood,306,"some Qushbegi documents (from 1903) tend to use fuqara to refer to the 'residents' of a province, and raya to refer to 'subjects' of the state of Bukhara, e.g.: آدم فرموده رعیه گان بخارای شریف فقریایان ولایت ضیا الدین را آورده",bukhara,1059.0
466,307,waba,وباء,wabāʾ,islam,health,307,"""Two terms dominated the classical Arabic plague terminology: ṭāʿūn, usually rendered as 'plague', and wabāʾ, a more general term for pestilential disturbance and contamination of the environment. While there is inconsistency and confusion in their use by various authors, in general wabāʾ is the more inclusive term"" (Pormann, Medieval Islamic Medicine, 59).",,
467,308,wafida,وافده,,islam,health,308,"used by Ibn Ridwan in medieval medicinal treatise to describe an epidemic: ""The meaning of an epidemic (al-wāfidah) illness is that it encompasses many people in one land at one time"" (Pormann, Medieval Islamic Medicine, 58).",,
468,309,mutasarrif,متصرف,mutaṣarrif,,,309,,,108.0
469,309,mutasarrif,متصرف,mutaṣarrif,,,309,governor or leutenant governor,ottomans,
470,310,rikab-i zafarrikab-i humayun,رکاب ظفررکاب همایون,rikāb-i ẓafar,,,310,,,72.0
471,310,rikab-i zafarrikab-i humayun,رکاب ظفررکاب همایون,rikāb-i ẓafar,,,310,,,237.0
472,311,amadani,,āmadanī,,,311,,,114.0
473,313,dawlat,دولت,,islam,,313,"""The transition from a polity based on the imperial household to one based on the bureaucracy coincided with the semantic transformation of the word devlet from a generic term meaning 'power and good fortune' in the earlier period to one signifying governmental apparatus and, eventually, from the seventeenth century on, a 'state' ruling over a people in a specific territory.""",ottomans,
474,314,muqata'a,مقاطعة,,ottoman,,314,"""Furthermore, in various regions, some units were defined as separate urban or rural revenue divisions (muḳāta‘a), which included mines, workshops, and customs.""",ottomans,
475,315,,التزام,,ottoman,,315,"""Furthermore, in various regions, some units were defined as separate urban or rural revenue divisions (muḳāta‘a), which included mines, workshops, and customs. The state either outsourced (iltizām) these divisions to contractors (mültezim) with shortterm revenue collection rights or managed them directly through salaried supervisors. Contractors collected revenues in these enterprises, remitted the amount agreed on in their contracts to the state or primary holders, and kept the rest as profit.""",ottomans,
476,316,mokasa,مکاسه,,indic,marathas,316,"""Villages or lands, or a share in the rule over them and revenue arising from them, granted on condition of military service or in Inám.""",,
477,316,mokasa,مکاسه,,indic,marathas,316,چنانچه مکاسه داران در محالات بهمین دستور بعمل آورده,,939.0
478,317,khandani,کهندنی,,indic,marathas,317,tribute,,
479,317,khandani,کهندنی,,indic,marathas,317,ساهوکار مبلغ هزار روپیه در کهندنی باقی مانده بود,,939.0
480,318,talabana,طلبانه,,,,318,"""Fee paid to a peon for serving a process; the fee payable to a witness; daily pay to constables, &c. (paid by those they guard).""",india,528.0
481,318,talabana,طلبانه,,,,318,مکاسه داران رعایا را تنگ ساخته بسختی تمام و طلبانه وجه کهندنی خود تحصیل کرده گرفته,india,939.0
482,319,tamassuk,تمسک,,,document_typefinancial,319,"""An obligation, bond, promissory note, note of hand, writing, instrument, receipt.""",,528.0
483,319,tamassuk,تمسک,,,document_typefinancial,319,﻿تحصیل عاملان گرفته تتمه را تمسک نوسانده گرفتند,,939.0
484,319,tamassuk,تمسک,,,document_typefinancial,319,"""These consist of all such documents which signify agreement, acknowledgment and undertakings and include, sureties, securities, bonds, deeds of conveyance and counterpart documents of the qabālāt-i-shar'iya mentioned above. Most of these are executed before the qadi and the witness, or required the attestation of the former.""",mughals,983.0
485,319,tamassuk,تمسک,,,document_typefinancial,319,"""As long as the end of the 18th century, there remained on the visage of Mughal Society the darkest blot of human exploitation, that is the trade of human beings. Helpless and down-trodden menials were bought and sold for such triples as rupees ten, to work as hired labourer for a period of not less than fifty years. The bond executed for the transaction is called tamassuk. The document which effects the emancipation of a slave is termed as wathīqa-yi-tāq.""",mughals,983.0
486,319,tamassuk,تمسک,,,document_typefinancial,319,"""A tamassuk was a bond recording a range of obligations. At the simplest, they could be the record of a loan taken; they could also be bonds of paid or unpaid service - a kind of deed of self-enslavement. As with many other documents for recording transactions, a tamassuk was usually an iqrar (a binding declaration) recorded in front of an Islamic judge (qazi) and validated by him in writing.""",india,992.0
487,320,farigh-khatti,,fārigh-khaṭṭī,indic,financiallegal,320,"""Unlike the tamassuk, the name of this documentary type appears to be wholly South Asian.""",india,
488,320,farigh-khatti,,fārigh-khaṭṭī,indic,financiallegal,320,Very close to the ṣulḥ-nāma in terms of function and content.,,
489,320,farigh-khatti,,fārigh-khaṭṭī,indic,financiallegal,320,"formula appearing both in exemplars and actual documents: ""these words in the manner of a fārigh-i khaṭṭī are written and given, so that they may be a record for the future"": این چند کلمه به طریقه فارغ خطی نوشته داده شد که ثانی الحال سند باشد",india,
490,320,farigh-khatti,,fārigh-khaṭṭī,indic,financiallegal,320,example of text renouncing claims and stating final payment: و این چند کلمه بطریق فارغخطی نوشته دادم که وقت حاجت بکار آید تمام و کمال وصول یافتم و سوای مبلغ هیچ دعوی بنده در محصول سال مذکور به فلان نمانده ,mughals,983.0
491,320,farigh-khatti,,fārigh-khaṭṭī,indic,financiallegal,320,"""A farigh-khatti was the written record of the fulfilment of obligations. They might be written when a loan was repaid, or a business partnership was terminated. The point of writing such a document was to produce a legal document to the effect that no dues remained payable from one party to another. In Bengali, Gujarati, Hindi, Marathi and Rajasthani, they were referred to as pharkhat, pharikhat or pharkati. In Marathi- and Gujarati-writing areas, they were used to record divorce settlements. These documents were usually, although not always, witnessed and sealed by a qazi.""",india,992.0
492,321,sulh-nama,صلحنامه,ṣulḥ-nāma,persianate,financiallegal,321,"""La Daʿwa Sulh Nama (Quittance Deed):Quittance deeds were produced after the resolution or termination of disputes, to record that the parties had no further claims on each other. To some extent, they were interchangeable with farigh-khattis, but the latter had a wider usage, for example as tax rexeipts, divorce deeds, and records of debt repayment. Also see farigh-khatti.""",india,992.0
493,322,dastur al-amal,دستور العمل,,indic,genre,322,"""The growing power and resources of these lower to mid-level [often Hindu] officers demanded a technical literature that could be used for instruction and reference in virtually any circumstances. This genre of Mughal Persian writing is usually referred to as the body of 'administrative manuals' or the dastūr al-ʿamal writings'. The surviving manuscripts (most in several copies) include glossaries and dictionaries of technical administrative terms; instructional tables for the novice first learning the chancery system of numerical notation (siyāqat, based on a shorthand version of Arabic words for the numerals); tables for eady reckoning of pay and allowances; copies of imperial regulations and rules; models and samples of official and semi-official letters (copies from the letter books of private secretaries to rulers and officials); sample orders, forms for routine administravie action and finally, models of letters of appointment to various official posts"" (8).",mughals,946.0
494,322,dastur al-amal,دستور العمل,,indic,genre,322,"""These manuals were reference works, for the secretary who needed to draft a letter of appointment to a provincial fiscal officer in proper form, for instance. They were used for instruction, but instruction was very much a private affair, given and regulated within the family rather than the regime"" (9).",mughals,946.0
495,322,dastur al-amal,دستور العمل,,indic,genre,322,"""At present, more than thirty Mughal administrative manuals have been identified, catalogued and utilized (some exist in unique, some in multiple copies)"" (9).",mughals,946.0
496,323,salis,,,indic,legal,323,"mediator in a legal context: ""Third a third person a mediator arbitrator umpire s̤ālis̤ biʼl-ḵẖair sm An unprejudiced or impartial arbitrator s̤ālis̤-s̤alās̤a.""",,528.0
497,325,pargana,پرگنه,,indic,province,325,"attested in the earliest surviving Mughal document (1527, Babur): ""The use of the administrative unit parganah, a term for a collection of villages which had been in official use in India from the 14th century, demonstrates the Mughals’ continued use of an existing administrative structure.""",mughals,
498,326,mutawajjihat,متوجهات,,indic,taxes,326,"attested in the earliest surviving Mughal document (1527, Babur): ""...the grant itself is called a suyurghāl, a Mongol term for a hereditary grant. Other new terms used are mutavajjihāt and māl u jihāt, both names of taxes found in documents of the Turkman and Timurid dynasties which ruled much of Iran during the 15th century.""",mughals,
499,327,malikana muqata,,,ottoman,taxesfinancialproperty,327,"""The life-term revenue tax farm (malikana muqataa) was a contract on state revenues which gave the tax contractor rights to collect taxes on the basis of established rates from the time of the award until the contractor's death. Usually these contracts were divided into shares held by more than one person... Public auctions for these life-term contracts were to be opened to both state elites and the provincial gentry.""",ottomans,
500,328,mu'ajjala,معجله,,,financial,328,"""The highest bidder [on a lifetime tax farm, malikane muqata] sealed his obligations to the state by the payment of an advance (muajjele), a sum which was officially estimated to correspond to two to three times the annual profit, but which was actually considerably higher.""",ottomans,
501,329,darugha-i adalat,داروغه عدالت,,indic,law,329,"""There arose a chain of appeals from the lowest to the highest. A case might be removed from any of the lower courts and might be brought before the Qazi of the prvoince, commonly called Darogha-e-Adalat.""",deccan,841.0
502,330,wilayat,ولایت,,islam,province,330,губерная,bukhara,296.0
503,330,wilayat,ولایت,,islam,province,330,владение,russian_turkestan,1135.0
504,331,tuman,تومان,,,property,331,уезд,bukhara,296.0
505,332,taraddud,تردد,,,agriculture,332,improvement of the land; cultivation,india,
506,332,taraddud,تردد,,,agriculture,332,بروقت سر سال لمبرداران هر دیه بتدبیر تردد اراضی مزروعه آن چنان خواهند پرداخت...,india,951.0
507,332,taraddud,تردد,,,agriculture,332,"""никаких мер не принимают"":‌ تردد نداشته اند",bukhara,1062.0
508,336,tah-bazari,ته بازاری,tah-bāzārī,indic,taxestrade,336,Ground-rent of a stall in a market; ground-rent or tax paid by shop-keepers in a market-place,india,528.0
509,336,tah-bazari,ته بازاری,tah-bāzārī,indic,taxestrade,336,Abolished in 1793 in Bengal Presidency,bengal,508.0
510,336,tah-bazari,ته بازاری,tah-bāzārī,indic,taxestrade,336,مسموع میشود که بابت رسوم ته بازاری احتساب بیضاپور بعلاقه نرخنویسی مزاحمت رسانیده ‌خلل اندازاند,deccan,80.0
511,338,maghfirat-ma'ab,مغفرت ماب,,,,338,title refers to someone who is now dead,,
512,339,tselkovyi,سولکه بای,,transoxania,money,339,قاضی اسلام لار ایکی سولکه بای پل الیب باکره نکاحینی قیلسونلار,,955.0
513,340,sayyib,ثیب,,islam,legalwomen,340,"a deflowered but unmarried woman, widow, dievorcee",,957.0
514,340,sayyib,ثیب,,islam,legalwomen,340,قاضی اسلام لار ایکی سولکه بای پل الیب باکره نکاحینی قیلسونلار و رئیس لار بر سولکه بای پل آلیب نکاح ثیبه قیلسونلار,,955.0
515,341,boza,بوزه,,,drink,341,و بوزه ایچماق و عرق ایچماق و قمار اویناماق  و زنا قیلماق و لواط قیلماق حرام ایکان,tashkent,955.0
516,342,bacha-bazi,بچه بازی,,persianate,,342,,,955.0
517,343,sum,صومصم,,transoxania,money,343,unusual spelling of صم instead of صوم attested,,959.0
518,343,sum,صومصم,,transoxania,money,343,note that there was no currency called Som; the word usually referred to Russian rubles,,
519,344,prustuf,پروستوف,,transoxania,province,344,قیزیل قوم پروستوفنینگ قاضیلار,,959.0
520,345,kulucha,کلوچه,,transoxania,militaryclothing,345,از دولت جناب عالی دکان گرفته ماشینه دوزی کرده اکثر کلوچه های یوزه بداش و غلامان سربازیه را دوخته مدتی بازارزوی دین شریف اسلام میکردیم,bukhara,958.0
521,345,kulucha,کلوچه,,transoxania,militaryclothing,345,Shodmon Vohidov: Формаи ҳарбии ба кител (kittel) монанд. Сарбоз ва афсарони бухоро мепушиданд. Бo пагон аз мовуӣи сахти кабуд ё хокиранг буд»,,
522,346,darubast,دروبست,,,,346,"entirely, all",,716.0
523,346,darubast,دروبست,,,,346,,,961.0
524,347,mahkama,محکمه,,,,347,управление,russian_turkestan,968.0
525,348,sawab-did,صوابدید,,,,348,جازه؛ تجویز,,8.0
526,350,hazir zamini,حاضر ضامنی,,indic,genre,350,An agreement to be responsible for someone else's taxes and appear before the government when the time comes to pay taxes.,india,
527,352,khadim al-fuqara,خادم الفقرا,,,honorific,352,this title always appears on Bukharan qazi-yi kalan seals,bukhara,966.0
528,353,aymaq,ایماق,,,,353,"For a summary of the fierce debates about the meaning of this term, see Paul, “Aymāq in 16th-Century Persian Sources from Central Asia. With a Document of Tax Exemption for the Descendants of Aḥmad Yasavī,” in From the Khan’s Oven: Essays on the History of Central Asian Religion in Honor of Devin DeWeese, ed. Jeff Eden, Allen Frank, and Eren Tasar (Leiden: Brill, 2021). Note that the term is common in Safavid sources, which is where much of the debate over it's meaning has taken place.",transoxania,
529,353,aymaq,ایماق,,,,353,"""nomads subject to taxation"": ""In the document published here, it is evident that aymāq has to do with social status, an inferior one. People listed among the aymāqāt pay taxes, and perhaps even specific ones, there is the term tavajjuhāt-i aymāqī, “aymāq dues”. ",transoxania,
530,353,aymaq,ایماق,,,,353,"in a 1958 Kyrgyz text, aymaq is used to refer to Semireche 'province'",soviet,
531,354,hiz,حیز,,,gender,354,in use in 19th-century official documentation in Russian Turkestan,,968.0
532,355,fara,فاره,,,police,355,قراویل لار فاره آلیب یب هیچ کیمکا آیتمیدو,tashkent,978.0
533,356,alban,البان,,,taxes,356,"present in Xinjiang Uyghur writing, often used on tandem with یساق, i.e. البان یساق",xinjiang,
534,356,alban,البان,,,taxes,356,often refers to corvee labor rather than a monetary tax,xinjiang,
535,358,kibitka,,,,taxesplace,358,kibitkas (nomadic households) were the basis of early Russian taxation,,
536,359,al-abd,العبد,,,,359,used in iqrār documents for countersigning,india,
537,360,bayyina,بینه,,,legal,360,"bayyina qāṭiʿa: ""unequivocal proof""",,
538,361,shahbandari,شهبندری,,ottoman,diplomacy,361,Ottoman term also used in Qajar texts to refer to a specifically Ottoman consulate,iran,904.0
539,363,hal,حال,ḥāl,,,363,"""spiritual sensitivity""",sufism,978.0
540,364,sani al-hal,ثانی الحال,,,,364,"used when a document will be 'of record' in the future, e.g. s̱ānī al-ḥāl sanad bāshad (e.g. in receipts)",india,
541,365,al-abd,,,,seal,365,written next to the seal when the person themself seals the document,,
542,367,dakchi-khana,داکچی خانه,,,infrastructure,367,"apparently used in Xinjiang as well (داکچی خانا), with Russian پوچتىخانا( included as a gloss",xinjiang,980.0
543,368,istifa,استیفا,istīfāʾ,islam,legal,368,"Mawardi makes a distinction between ijtihād, which is associated with scholarship, and istīfāʾ / tanfīdh, which is associated with rulership.",,
544,368,istifa,استیفا,istīfāʾ,islam,legal,368,أَخْذُ صاحِبِ الحَقِّ حَقَّهُ كامِلًا دون أنْ يَتْرُكَ مِنْهُ شَيْئًا,,
545,368,istifa,استیفا,istīfāʾ,islam,legal,368,صاحب نفایس الفنون گوید: علم استیفا عبارت است از معرفت قوانین که بدان ضبط دخل دیوان و کیفیت و کمیت محاسبات معلوم کنند,,982.0
546,368,istifa,استیفا,istīfāʾ,islam,legal,368,استیفا در اصطلاح دیوانی عبارت از شغل و عمل مستوفی است که کار مستوفی رسیدگی به امور مالی و تنظیم دفتر های مربوط بآن ایضا دخل و خرج یک ولایت یا همه مملکت بوده است,,982.0
547,369,tashrif,تشریف,,,,369,آنچه پادشاهان و سلاطین برای اظهار عاطفت و بزرگداشت به کسی میدادند و این لفظ شامل خلعت، القاب، و اجازه استفاده از برخی اشیاء میشده است,,982.0
548,370,khidmat,خدمت,,,,370,هدیه، تحفه,,982.0
549,370,khidmat,خدمت,,,,370,عریضه، نامه که بسلطان و بزرگان نویسند,,982.0
550,371,ism-i tafdil,اسم تفضیل,,,terminology,371,"""Similarly [to the emperor] the highest officials and nobles of the Court were all assigned high-flown titles and Nouns of comparison (ism-i-tafdil). Each was likened to a support or a prop (i'tiḍad) of the vault on which rested the Empire.""",mughals,983.0
